16	ਵ ਰਾਏ, ਰਾਸਤੀ ਨੁਮਾਇਸ਼; ਸਦਰ ਨਸ਼ੀਨੇ ਜਾਵਿਦਾਨੀ ਸਰੀਰ॥			The truth-telling 'Ray' deserves to be seated respectfully with the status of a president on the eternal throne.				
16	ਕਾਫ਼ੇ ਤਾਜ਼ੀਏ ਆਂ; ਕੁਸ਼ਾਇੰਦ-ਹਏ ਅਬ-ਵਾਬੇ ਕਰਮ			The Arabic 'Kaaf' in his name can open the doors of generosity and benevolence,				
16	ਵ ਸ਼ੀਨੇ ਸ਼ੌਕਤ ਤਜ਼ਮੀਨਸ਼; ਸਰ ਅਫ਼ਗਨੇ ਦੇਵਾਨੇ ਦੱਯਮ॥			and the glorious 'Sheen' with its pomp and show can tame and overpower even the tiger-like strong monsters.				
16	ਨੂਨੇ ਆਖ਼ਿਰਸ਼, ਨੁਜ਼-ਹੁਤ ਅਫ਼ਜ਼ਾਏ ਹਰ ਦਿਲੋ ਜਾਨਾ			The last 'Noon' in his name brings and enhances freshness and aroma in life				
16	ਵ ਨਦੀਮੇ, ਖ਼ਾਸ ਨਿਅ਼-ਮੁਲ-ਸੁਬਹਾਂ॥੯੨॥			and is the closest friend of the God-given boons. (92)				
17	ਵਾਹਿਗੁਰੂ ਜੀਉ ਸਤ			Waaheguru is the Truth				
17	ਗੁਰੂ ਹਰਿ ਕਿਸ਼ਨ ਆਂ ਹਮਾ ਫ਼ਜਲੋ ਜੂਦ			Guru Har Kishen is the embodiment of grace and beneficence,				
17	ਹੱਕਸ਼ ਅਜ਼ ਹਮਾ ਖ਼ਾਸਗਾਂ ਬ-ਸਤੂਦ॥੯੩॥			And is the most admired one out of all special and selected near-ones of Akaalpurakh. (93)				
17	ਮਿਆਨਿ ਹੱਕੇ ਊ ਫ਼ਸਾਲੁ-ਲ ਵਰੱਕ			The dividing wall between him and the Akaalpurakh is just a thin leaf,				
17	ਵਜੂਦਸ਼ ਹਮਾ ਫ਼ਜਲੋ ਅਫ਼ਜ਼ਾਲਿ ਹੱਕ॥੯੪॥			His entire physical existence is a bundle of Waaheguru's compassion and bestowals. (94)				
17	ਹਮਾ ਸਾਇਲੇ ਲੁਤਫ਼ਿ ਹੱਕ ਪਰਵਰਸ਼			Both the worlds become successful because of his mercy and grace,				
17	ਜ਼ਮੀਨੋ ਜ਼ਮਾਂ ਜੁਮਲਾ ਫ਼ਰਮਾਂ ਬਰਸ਼॥੯੫॥			And, it is his kindness and clemency that brings out the strong and powerful shine of the sun in the smallest particle. (95)				
17	ਤੁਫ਼ੈਲਸ਼ ਦੋ ਆਲਮ ਖ਼ੁਦ ਕਾਮਯਾਬ			All are petitioners for his divinely sustaining boons,				
17	ਅਜ਼ੋ ਗਸ਼ਤਾ ਹਰ ਜ਼ੱਰਾ ਖ਼ੁਰਸ਼ੀਦ ਤਾਬ॥੯੬॥			And, the entire world and the age are the followers of his command. (96)				
17	ਹਮਾ ਖ਼ਾਸਗਾਂ ਰਾ ਕਫ਼ਿ ਇਸਮਤਸ਼			His protection is a God-given gift to all of his loyal followers,				
17	ਸਰਾ ਤਾ ਸਮਾ ਜੁਮਲਾ ਫ਼ਰਮਾਂ-ਬਰਸ਼॥੯੭॥			And, everyone, from the underworld to the skies, is subservient to his command. (97)				
18	ਸਲਤ਼ਨਤੇ ਨੁਹਮ			The Nineth Guru,Guru Tegh Bahadur Ji				
18	ਸਲਤ਼ਨਤੇ ਨੁਹਮਸ਼, ਨੌ ਆਈਨਿ-ਤਰ			The nineth Guru, Guru Teg Bahadur Ji, with a new agenda				
18	ਵ ਸਰਵਰੇ ਸਰਵ-ਰਾਨੇ, ਹ਼ੱਕ਼ ਪਰਵਰ॥			was the chief of the heads of protectors of the truth.				
18	ਸੁਲਤ਼ਾਨੁਲ, ਦੁਨੀਆ - ਵਲ - ਆਖ਼ਿਰਤ			He was the ornate of the honored				
18	ਵ ਤਖ਼ਤ-ਆਰਾਏ; ਇਅ਼ਜਾਜ਼-ਵਲ-ਮੁਫ਼ਾ-ਖ਼ਿਰਤ॥			and proud throne of the Lord of both the worlds.				
18	ਬਾਵਜੂਦ, ਕ਼ਦਰੇ ਕ਼ੁਦਰਤੇ ਵਾਲਾ			In spite of the fact that he was the master of divine power,				
18	ਸਰ ਨਿਹਾਦ-ਹਏ, ਤਸਲੀਮ ਵ ਰਜ਼ਾ॥			he still would always acquiesce and bow before the will and command of Waaheguru				
18	ਵ ਪਿਨਹਾਂ-ਸਾਜ਼ੇ, ਅ਼ਜ਼ਮਤ ਵ ਅਜਲਾਲੇ ਕੁਬਰਾ			and was the mysterious instrument for the godly glory and majestic grandeur.				
18	ਅਜ਼ਮਾਇਸ਼ ਗਰੇ, ਇਰਾਦਤ ਗੁਜ਼ੀਨਾਨੇ ਬਾ-ਸਫ਼ਾ॥			His personality was such that he had the capability of putting those who were his chaste and loyal followers to a severe test				
18	ਵ ਜਾਂ ਪਰਵਰ, ਅ਼ਕ਼ੀਦਤ ਆਈਨਾਨੇ ਬੇਰਿਯਾ			and to invigorate those devotees who follow an impartial methodology				
18	ਜਬਰੂਤੀਆਂ ਮਤ਼ਾਅ, ਲਾ-ਹੂਤੀਆਂ ਇਰ-ਤਿਫ਼ਾਅ਼॥			and made those devotees win the heavens.				
18	ਕ਼ਾਇਮ ਬਿਲ-ਜ਼ਾਤੇ, ਹ਼ੱਕ਼ੁਲ ਕ਼ਦੀਮ			The travelers on the grand divine path and the inhabitants of the next world were existent due to his personality that was totally dependent on the truth				
18	ਵਾ ਦਾਇਮ ਨਦੀਮੇ, ਸੁਬਹ਼ਾਨੁਲ ਅ਼ਜ਼ੀਮ॥			and was a close companion of the highest spiritual power				
18	ਅਫ਼ਸਰੇ ਬਰ ਗੁਜ਼ੀਦ-ਗਾਨੇ ਖ਼ਾਸ			He was the crown of the specialy selected devotees				
18	ਵ ਤਾਜੇ ਹ਼ੱਕ਼ ਪਰਵਰਾਨੇ, ਹ਼ਕ਼ੀਕ਼ਤ ਇਖ਼-ਤਸਾਸ॥			and the coronet of the proponents of God's adherents with truthful virtues.				
18	ਤਾਏ ਨਾਮੇ, ਮੈਮਨਤ ਇਲਤਿਯਾਮਸ਼; ਤਜ਼ਈਨੇ ਤਵੱਕੁਲ ਵ ਤਸਲੀਮ			The blessed 'Tay' in his name was a believer in living under His will and command.				
18	ਵ ਯਾਏ ਫ਼ਾਰਸੀਅਸ਼; ਯਕ਼ੀਨੇ ਕਾਮਿਲੁਲ ਅ਼ਜ਼ੀਮ॥			The Farsi 'Yay' was the indicative of complete faith;				
18	ਕਾਫ਼ੇ ਮੁਬਾਰਿਕੇ ਅ਼ਜਮੀਅਸ਼; ਕਰੀਮੁਲ ਨਫ਼ਸੇ ਸਰਾਪਾ ਹ਼ਿਲਮ			the blessed Farsi 'Kaaf ('Gaggaa') was representing his god-blessed personality as an embodiment of humility from head to his feet;				
18	ਵਾ ਬਾਏ ਬਾ-ਹਾਇਸ਼; ਬਜ਼ਮ ਆਰਾਏ, ਹਦਾਇਤ ਵ ੲ਼ਿਲਮ॥			The 'Bay' along with 'Hay' was the adornment of the social and cultural party in education and teaching.				
18	ਅਲਿਫ਼ੇ ਹ਼ੱਕ਼ ਮੁਅੱਲਿ-ਫ਼ਸ਼; ਆਰਾਇਸ਼ੇ ਹ਼ੱਕ਼ ਈਕ਼ਾਨ॥			The truth-compiled 'Alif' was the embellishment of the truth;				
18	ਵ ਦਾਲੇ ਏਜ਼ਦੀ ਜਮਾਲਸ਼, ਦਾਵਰੇ ਕੌਨ ਵ ਮਕਾਂਨ॥			the infinitely formed 'Daal' in his name was the just and fair ruler of both the worlds.				
18	ਰਾਏ ਆਖ਼ਿਰਸ਼, ਰਮਜ਼ ਸ਼ਨਾਸੇ ਰਾਹੇ ਤ਼ਰੀਕ਼ਤ			The last 'Ray' understood and appreciated the divine mysteries				
18	ਵ ਹ਼ੱਕ਼ ਅਸਾਸੇ, ਵਾਲਾ ਹ਼ਕ਼ੀਕ਼ਤ॥੯੮॥			and was the rightful foundation of the highest truth. (98)				
19	ਵਾਹਿਗੁਰੂ ਜੀਉ ਸਤ			Waaheguru is the Truth				
19	ਗੁਰੂ ਤੇਗ਼ ਬਹਾਦੁਰ ਆਂ ਸਰਾਪਾ ਅਫ਼ਜ਼ਾਲ			Guru Teg Bahadur was the storehouse of elevated moralities and virtues,				
19	ਜ਼ੀਨਤ-ਆਰਾਇ ਮਹਿਫਲਿ ਜਾਹੋ ਜਲਾਲ॥੯੯॥			And, he was instrumental to enhance the gaiety and pomp and show of the divine parties. (99)				
19	ਅਨਵਾਰਿ ਹੱਕ ਅਜ਼ ਵਜੂਦਿ ਪਾਕਿਸ਼ ਰੌਸ਼ਨ			The rays of truth derive their brightness from his sacred torso,				
19	ਹਰ ਦੋ ਆਲਮ ਜ਼ਿ ਫ਼ੈਜ਼ਿ ਫ਼ਜਲਸ਼ ਰੌਸ਼ਨ॥੧੦੦॥			And, both the worlds are bright because of his grace and blessings. (100)				
19	ਹੱਕ ਅਜ਼ ਹਮਾ ਬਰਭਗ਼ੁਜ਼ੀਦਗਾਂ ਬਰਗ਼ੁਜ਼ੀਦਸ਼			Akaalpurakh chose him fro among His selected elite,				
19	ਤਸਲੀਮੋ ਰਿਜ਼ਾ ਰਾ ਨਿਕੋ ਸੰਜੀਦਸ਼॥੧੦੧॥			And, he considered accepting His will as the loftiest bevahior. (101)				
19	ਬਰ ਹਰ ਮੁਕਬਲ ਕਬੂਲਿ ਖ਼ੁੱਦ ਅਰਜ਼ੂਦਸ਼			His status and rank is far higher than those selected accepted ones,				
19	ਮਸਜੂਦੁਲ ਆਲਮੀਂ ਜ਼ਿ ਫ਼ਜਲਿ ਖ਼ੁੱਦ ਫ਼ਰਮੂਦਸ਼॥੧੦੨॥			And, with His own benevolence, He made him worshippable in both the worlds. (102)				
19	ਦਸਤਿ ਹਮਾਂ-ਗਾਂ ਬਜ਼ੈਲਿ ਅਫ਼ਜ਼ਾਲਿ ਊ			Everyone's hand is trying to grab the corner of his beneficent robe,				
19	ਬਰ ਸਰਿ ਅਨਵਾਰਿ ਇਲਮਿ ਹੱਕ ਕਾਲਿ ਊ॥੧੦੩॥			And, his message of truth is far more elevated than the glow of divine enlightenment. (103)				
20	ਸਲਤ਼ਨਤੇ ਦੁਹਮ			The Tenth Guru,Guru Gobind Singh Ji				
20	ਸਲਤ਼ਨਤੇ ਦੁਹਮਸ਼, ਦਸਤ ਪੇਚੇ ਦੇਵਾਨੇ ਦੌਰਗੀਰ			The Tenth Guru, Guru Gobind Singh Ji, had the capability of twisting the arms of the goddess that overpowered the world.				
20	ਵ ਜ਼ੇਬੋ ਆਰਾਇਸ਼ੇ, ਜਾਵਿਦਾਨੀ ਸਰੀਰ॥			He was sitting on the eternal throne from where he bestowed a special honor to it.				
20	ਜਲਵਹ ਆਰਾਏ, ਆਂ ਨੁਹ ਮਸ਼ਅ਼ਲੇ, ਹ਼ੱਕ਼ ਫ਼ਰੋਗ਼			He was the one to exhibit the panorama of the nine-lighted torches displaying the 'truth'				
20	ਵ ਜ਼ੁਲਮਤ ਜ਼ਦਾਏ ਸ਼ਬੇ, ਕਿਜ਼ਬ ਵ ਦਰੋਗ਼॥			and annihilating the night of darkness of lies and untruths.				
20	ਸੁਲਤ਼ਾਨਉਲ, ਅੱਵਲ ਵਲ ਆਖ਼ਿਰ			The master of this throne was the first and the last monarch				
20	ਵ ਬਾਸਿਰ ਉਲ, ਬਾਤ਼ਿਨ ਵੱਲ ਜ਼ਾਹਿਰ॥			who was divinely equipped to visualize the interior and exterior happenings.				
20	ਮੁਸ਼-ਤਹਿਰ ਸਾਜ਼ੇ, ਕ਼ੁਦਸੀ ਇਅ਼-ਜਾਜ਼			He was the one to expose the instruments of sacred miracles				
20	ਵ ਅਜ਼ ਹਰ ਤ਼ਾਅ਼ਤ, ਵ ਖ਼ਿਦਮਤ ਬੇ-ਨਿਆਜ਼॥			and to lighten the principles of service for the All-powerful Waaheguru and meditation.				
20	ਸ਼ੇਰਾਨੇ ਅਫ਼ਵਾਜ਼ੇ, ਮਨਸੂਰਹ ਅਸ਼, ਯੱਕਾ-ਤਾਜ਼			His brave victorious tiger-like valiant soldiers would overshadow every place in every instant.				
20	ਵ ਲਿਵਾਇ ਅ਼ਾਲਮ ਕੁਸ਼ਾਇਸ਼, ਨੁਸਰਤ ਤ਼ਰਾਜ਼॥			His redeeming and emancipating flag was adorned with victory at its borders.				
20	ਕਾਫ਼ੇ ਫ਼ਾਰਸੀ, ਅਜ਼ ਨਾਮੇ ਹ਼ੱਕ਼ ਇਖ਼-ਤਿਤਾਮਸ਼, ਗੇਤੀ ਸਿਤਾਂ			The eternal truth-depicting Farsi 'Kaaf' (Gaaf) in his name is the one to overcome and conquer the whole world;				
20	ਵ ਵਾਵੇ ਬਾਦੀ, ਵਾਸਿਤ਼ਾਏ ਕ਼ਿਅ਼ਾਮੇ ਜ਼ਮੀਨੋ ਜ਼ਮਾਂ॥			the first 'Vaayo' is to connect the positions of the earth and the world.				
20	ਬਾਏ ਅਬਦ ਬਕ਼ਾਇਸ, ਬਖ਼ਸ਼ਿੰਦ-ਹਏ ਪਨਾਹਿੰਦ-ਗਾਂ			The 'Bay' of immortal life is the one to pardon and bless the refugees;				
20	ਵ ਸ਼ਮੀਮੇ, ਨੂਨੇ ਹੁਮਾਯੂਨਸ਼; ਨਵਾਜ਼ਿੰਦ-ਹਏ ਪ੍ਰਿਸਤੰਦ-ਗਾਂ॥			the aroma of the sacred 'Noon' in his name will honor the meditators.				
20	ਦਾਲੇ ਸਰਾਪਾ, ਅ਼ਜ਼ਮਤ ਵ ਇਜਲਾਲਸ਼, ਦਾਮ ਗੁਸਲੇ ਮਰਗ			The 'Daal' in his name, representing his virtues and gaiety, will break the snare of death				
20	ਵ ਸੀਨੇ, ਸਰਾਪਾ ਵਾਲਾ ਤਮਕੀਨਸ਼; ਸਰਮਾਇ-ਆਏ, ਹਰ ਸਾਜ਼ ਵ ਬਰਗ॥			and his highly impressive 'Seen' is the asset of life.				
20	ਬੂਏ ਨੂਨੇ, ਦਾਇਮਾ ਨਦੀਮੇ ਸੁਬਹ਼ਾਨੀ			The 'Noon' in his name is the congregationalist of the Omnipotent;				
20	ਵ ਸਾਨੀ, ਕਾਫ਼ੇ ਅ਼ਜਮੀਯਸ਼ ਜਾਂ-ਗੁਜ਼ਾਏ; ਬਾਦੀਆ ਪੈਮਾਯਾਂਨੇ ਬੇਫ਼ਰਮਾਨੀ॥			and the second Farsi 'Kaaf' (Gaaf) is the one to decompose the lives of those strayed in the jungles of non-obedience.				
20	ਹਾਏ ਆਖ਼ਿਰੀਨ ਬਾਦੀ; ਹਾਦੀ-ਉਲ ਕੋਨੈਨੇ ਬਰ ਹ਼ੱਕ਼॥			The last 'Hay' is the true guide to steer to the right path in both the worlds				
20	ਵ ਕੋਸੇ, ਹਦਾਯਤ ਵ ਇਰਸ਼ਾਦਸ਼; ਬਰ ਨੁਹ ਤਬਕ਼॥			and the big drums of his teachings and command is resounding over the nine skies.				
20	ਸਦ ਹਜ਼ਾਰਾਂ; ਸੁਲਮ ਵ ਸੁਦਸ, ਖ਼ਿਦਮਤ-ਗੁਜ਼ੀ			People from the three universes and six directions are at his beck and call;				
20	ਵ ਸੁਦਸ ਹਜ਼ਾਰਾਂ; ਰੁਬਅ਼ ਵ ਤਿਸਅ਼, ਖ਼ਾਕਿ-ਨਸ਼ੀਂ॥			Thousands from the four oceans and nine cosmos				
20	ਸਦ ਹਜ਼ਾਰਾਂ, ਅਸ਼ਰ ਵ ਸੁਲਮ, ਵ ਸਲਾਸੂਨ; ਸਤਾਇੰਦ-ਹਏ ਬਾਰਗਾਹਸ਼			and millions from the ten directions appreciate and praise his divine court;				
20	ਸਦ ਹਜ਼ਾਰਾਂ, ਈਸ਼ਰ ਵ ਬ੍ਰਹਮਾਂ, ਬ ਅ਼ਰਸ਼ ਵ ਕੁਰਸੀ; ਖ਼ਾਹਿੰਦ-ਹਏ ਪਨਾਹਸ਼॥			Millions of Ishars, Brahmaas, Arshes, and Kurshes are anxious to seek his patronage and protection,				
20	ਵ ਸਦ ਹਜ਼ਾਰਾਂ, ਆਸਮਾਨ ਵ ਜ਼ਮੀਨ; ਹ਼ਲਕ਼ਹ ਬ-ਗੋਸ਼ੇ ਆਂ-ਨਸਤ			and millions of earths and skies are his slaves.				
20	ਵ ਸਦ ਹਜ਼ਾਰਾਂ, ਆਫ਼ਤਾਬ ਵ ਮਾਹ; ਖ਼ਿਲਅ਼ਤ ਪੋਸ਼ੇ ਆਂ-ਨਸਤ॥			Hundreds of thousands of suns and moons have earned the blessings of wearing the robes bestowed by him,				
20	ਸਦ ਹਜ਼ਾਰਾਂ, ਅ਼ਰਸ਼ ਵ ਕੁਰਸੀ; ਦਾਗ਼ਦਾਰ ਵ ਗ਼ੁਲਾਮੇ ਨਾਮਸ਼			and millions of skies and universes are captives of his Naam and are suffering from his separation.				
20	ਵ ਸਦ ਹਜ਼ਾਰਾਂ, ਰਾਮ ਵ ਰਾਜਾ; ਵ ਕਾਨ੍ਹ ਵ ਕ੍ਰਿਸ਼ਨ, ਖ਼ਾਕਿ ਬੋਸੇ ਅਕ਼-ਦਾਮਸ਼॥			Similarly, millions of Ramas, Rajas, Kahans and Krishnas are putting the dust of his lotus feet on their foreheads				
20	ਸਦ ਹਜ਼ਾਰਾਂ; ਮੁਕ਼ਬਿਲੇ ਖ਼ਾਸੇ ਹ਼ਮਦੀਯਤ, ਸਤਾਇਸ਼-ਗਰਸ਼			and thousands of the accepted and selected ones are reciting his eclat with their thousands of tongues.				
20	ਵ ਸਦ ਹਜ਼ਾਰਾਂ, ਨਦੀਮ ਬਾਰਗਾਹੇ ਅਹ਼ਦੀਯਤ; ਚਾਕਰੇ ਫ਼ਰਮਾਂ-ਬਰਸ਼॥			and thousands of accept his orders and act in his service				
20	ਵ ਸਦ ਹਜ਼ਾਰਾਂ, ਇੰਦਰ ਵ ਮਾਰੇ; ਹਜ਼ਾਰ ਜ਼ਬਾਨਸ਼॥			and thousands of Indras and Sheshnagas praise him				
20	ਸਦ ਹਜ਼ਾਰਾਂ, ਈਸ਼ਰ ਵ ਬ੍ਰਹਮਾਂ; ਅ਼ਕ਼ੀਦਤ ਪਯੋਹਸ਼॥			Millions of Ishars and Brahmas are his adherents				
20	ਵ ਸਦ ਹਜ਼ਾਰਾਂ, ਉੱਮੇ ਕ਼ੁਦਸੀ; ਦਰ ਖ਼ਿਦਮਤਸ਼॥			and millions of sacred mothers, the true powers of organizing the earths and the skies,				
20	ਵ ਸਦ ਹਜ਼ਾਰਾਂ, ਕ਼ਦਰ ਵ ਕ਼ੁਦਰਤ; ਪਜ਼ੀਰਸ਼-ਗਰੇ ਤ਼ਾਅ਼ਤਸ਼॥੧੦੪॥			are standing in his service and millions of powers are accepting his commands. (104)				
21	ਵਾਹਿਗੁਰੂ ਜੀਉ ਸਤ			Waaheguru is the Truth				
21	ਨਾਸਿਰੋ ਮਨਸੂਰ ਗੁਰੂ ਗੋਬਿੰਦ ਸਿੰਘ			Guru Gobind Singh: Protector of the poor and destitute:				
21	ਈਜ਼ਦਿ ਮਨਜ਼ੂਰ ਗੁਰੂ ਗੋਬਿੰਦ ਸਿੰਘ॥੧੦੫॥			In the protection of Akaalpurakh, and accepted in the court of Waaheguru (105)				
21	ਹੱਕ ਰਾ ਗੰਜ਼ੂਰ ਗੁਰੂ ਗੋਬਿੰਦ ਸਿੰਘ			Guru Gobind Singh is the repository of truth				
21	ਜੁਮਲਾ ਫ਼ੈਜ਼ਿ ਨੂਰ ਗੁਰੂ ਗੋਬਿੰਦ ਸਿੰਘ॥੧੦੬॥			Guru Gobind Singh is the grace of the entire brilliance. (106)				
21	ਹੱਕ ਹੱਕ ਆਗਾਹ ਗੁਰੂ ਗੋਬਿੰਦ ਸਿੰਘ			Guru Gobind Singh was the truth for the connoisseurs of truth,				
21	ਸ਼ਾਹਿ ਸ਼ਹਨਸ਼ਾਹ ਗੁਰੂ ਗੋਬਿੰਦ ਸਿੰਘ॥੧੦੭॥			Guru Gobind Singh was the king of kings. (107)				
21	ਬਰ ਦੋ ਆਲਮ ਸ਼ਾਹ ਗੁਰੂ ਗੌਬਿੰਦ ਸਿੰਘ			Guru Gobind Singh was the king of both the worlds,				
21	ਖ਼ਸਮ ਰਾ ਜਾਂ-ਕਾਹ ਗੁਰੂ ਗੋਬਿੰਦ ਸਿੰਘ॥੧੦੮॥			And, Guru Gobind Singh was the conqueror of the enemy-lives. (108)				
21	ਫ਼ਾਇਜ਼ੁਲ ਅਨਵਾਰ ਗੁਰੂ ਗੋਬਿੰਦ ਸਿੰਘ			Guru Gobind Singh is the bestower of divine radiance.				
21	ਕਾਸ਼ਫ਼ੁਲ ਅਸਰਾਰ ਗੁਰੂ ਗੋਬਿੰਦ ਸਿੰਘ॥੧੦੯॥			Guru Gobind Singh is the Revealer of the divine mysteries. (109)				
21	ਆਲਿਮੁਲ ਅਸਤਾਰ ਗੁਰੂ ਗੋਬਿੰਦ ਸਿੰਘ			Guru Gobind Singh is knowledgeable of the secrets behind the screen,				
21	ਅਬਰਿ ਰਹਿਮਤ ਬਾਰ ਗੁਰੂ ਗੋਬਿੰਦ ਸਿੰਘ॥੧੧੦॥			Guru Gobind Singh is the one show showers blessings all over. (110)				
21	ਮੁਕਬੁਲੋ ਮਕਬੂਲ ਗੁਰੂ ਗੋਬਿੰਦ ਸਿੰਘ			Guru Gobind Singh is the accepted one and is the favorite of everyone.				
21	ਵਾਸਲੋ ਮੌਸੂਲ ਗੁਰੂ ਗੋਬਿੰਦ ਸਿੰਘ॥੧੧੧॥			Guru Gobind Singh is connected with the Akaalpurakh and is capable of connecting with Him. (111)				
21	ਜਾਂ-ਫ਼ਰੋਜ਼ਿ ਦਹਿਰ ਗੁਰੂ ਗੋਬਿੰਦ ਸਿੰਘ			Guru Gobind Singh is the bestower of life to the world,				
21	ਫ਼ੈਜ਼ਿ ਹੱਕ ਰਾ ਬਹਿਰ ਗੁਰੂ ਗੋਬਿੰਦ ਸਿੰਘ॥੧੧੨॥			And Guru Gobind Singh is the ocean of the divine blessings and grace. (112)				
21	ਹੱਕ ਰਾ ਮਹਿਬੂਬ ਗੁਰੂ ਗੋਬਿੰਦ ਸਿੰਘ			Guru Gobind Singh is the beloved of Waaheguru,				
21	ਤਾਲਿਬੋ ਮਤਲੂਬ ਗੁਰੂ ਗੋਬਿੰਦ ਸਿੰਘ॥੧੧੩॥			And, Guru Gobind Singh is the seeker of God and is likeable and desirable of the people. (113)				
21	ਤੇਗ਼ ਰਾ ਫ਼ਤਾਹ ਗੁਰੂ ਗੋਬਿੰਦ ਸਿੰਘ			Guru Gobind Singh is affluent in swordsmanship,				
21	ਜਾਨੋ ਦਿਲ ਰਾ ਰਾਹ ਗੁਰੂ ਗੋਬਿੰਦ ਸਿੰਘ॥੧੧੪॥			And Guru Gobind Singh is the elixir for the heart and the soul. (114)				
21	ਸਾਹਿਬਿ ਅਕਲੀਲ ਗੁਰੂ ਗੋਬਿੰਦ ਸਿੰਘ			Guru Gobind Singh is the master of all crowns,				
21	ਜ਼ਿਬਿ ਹੱਕ ਤਜ਼ਲੀਲ ਗੁਰੂ ਗੋਬਿੰਦ ਸਿੰਘ॥੧੧੫॥			Guru Gobind Singh is the image of the shadow of Akaalpurakh. (115)				
21	ਖ਼ਾਜ਼ਨਿ ਹਰ ਗੰਜ ਗੁਰ ਗੋਬਿੰਦ ਸਿੰਘ			Guru Gobind Singh is the treasurer of all treasures,				
21	ਬਰਹਮਿ ਹਰ ਰੰਜ ਗੁਰ ਗੋਬਿੰਦ ਸਿੰਘ॥੧੧੬॥			And, Guru Gobind Singh is the one who dispels all sorrows and pains. (116)				
21	ਦਾਵਰਿ ਆਫ਼ਾਕ ਗੁਰ ਗੋਬਿੰਦ ਸਿੰਘ			Guru Gobind Singh rules in both the worlds,				
21	ਦਰ ਦੋ ਆਲਮ ਤਾਕ ਗੁਰ ਗੋਬਿੰਦ ਸਿੰਘ॥੧੧੭॥			And, there is no rival to Guru Gobind Singh in the two worlds. (117)				
21	ਹੱਕ ਖ਼ੁਦ ਵੱਸਾਫ਼ਿ ਗੁਰ ਗੋਬਿੰਦ ਸਿੰਘ			Waaheguru Himself is the balladeer of Guru Gobind Singh,				
21	ਬਰ ਤਰੀਂ ਔਸਾਫ਼ਿ ਗੁਰ ਗੋਬਿੰਦ ਸਿੰਘ॥੧੧੮॥			And, Guru Gobind Singh is the composite of all noble virtues. (118)				
21	ਖ਼ਾਸਗਾਂ ਦਰ ਪਾਇ ਗੁਰ ਗੋਬਿੰਦ ਸਿੰਘ			The elite of Akaalpurakh prostrate at the lotus feet of Guru Gobind Singh				
21	ਕੁੱਦਸੀਆਂ ਬਾ ਰਾਇ ਗੁਰ ਗੋਬਿੰਦ ਸਿੰਘ॥੧੧੯॥			And, those entities that are sacred and near ones of Waaheguru are under Guru Gobind Singh's command. (119)				
21	ਮੁਕਬਲਾਂ ਮੱਦਾਹਿ ਗੁਰ ਗੋਬਿੰਦ ਸਿੰਘ			Persons and entities accepted by Waaheguru are the admirers of Guru Gobind Singh,				
21	ਜਾਨੋ ਦਿਲ ਰਾ ਰਾਹ ਗੁਰ ਗੋਬਿੰਦ ਸਿੰਘ॥੧੨੦॥			Guru Gobind Singh bestows tranquility and serenity to both heart and the soul. (120)				
21	ਲਾ-ਮਕਾਂ ਪਾ-ਬੋਸਿ ਗੁਰੂ ਗੋਬਿੰਦ ਸਿੰਘ			The Eternal Entity kisses the lotus feet of Guru Gobind Singh,				
21	ਬਰ ਦੋ ਆਲਮ ਕੌਸਿ ਗੁਰੂ ਗੋਬਿੰਦ ਸਿੰਘ॥੧੨੧॥			And, the kettledrum of Guru Gobind Singh resounds in both the worlds. (121)				
21	ਸੁਲਸ ਹਮ ਮਹਿਕੂਮਿ ਗੁਰੂ ਗੋਬਿੰਦ ਸਿੰਘ			All the three universes obey the command of Guru Gobind Singh,				
21	ਰੁੱਬਆ ਹਮ ਮਖ਼ਤੂਮਿ ਗੁਰੂ ਗੋਬਿੰਦ ਸਿੰਘ॥੧੨੨॥			And, all the four principal mineral deposits are under his seal. (122)				
21	ਸੁਦਸ ਹਲਕਾ ਬਗੋਸ਼ਿ ਗੁਰੂ ਗੋਬਿੰਦ ਸਿੰਘ			The whole world is a slave to Guru Gobind Singh,				
21	ਦੁਸ਼ਮਨ-ਅਫ਼ਗਾਨ ਜੋਸ਼ਿ ਗੁਰੂ ਗੋਬਿੰਦ ਸਿੰਘ॥੧੨੩॥			And, he annihilates his enemies with his zeal and enthusiasm. (123)				
21	ਖ਼ਾਲਿਸੋ ਬੇ-ਕੀਨਾ ਗੁਰੂ ਗੋਬਿੰਦ ਸਿੰਘ			Guru Gobind Singh's heart is chaste and free from any kind of enmity or feeling of alienation,				
21	ਹੱਕ ਹੱਕ ਆਈਨਾ ਗੁਰੂ ਗੋਬਿੰਦ ਸਿੰਘ॥੧੨੪॥			Guru Gobind Singh is truth himself and is the mirror of truthfulness. (124)				
21	ਹੱਕ ਹੱਕ ਅੰਦੇਸ਼ ਗੁਰੂ ਗੋਬਿੰਦ ਸਿੰਘ			Guru Gobind Singh is the true observant of truthfulness,				
21	ਬਾਦਸ਼ਾਹ ਦਰਵੇਸ਼ ਗੁਰੂ ਗੋਬਿੰਦ ਸਿੰਘ॥੧੨੫॥			And, Guru Gobind Singh is the mendicant and king as well. (125)				
21	ਮਕਰਮੁਲ-ਫ਼ਜ਼ਾਲ ਗੁਰੂ ਗੋਬਿੰਦ ਸਿੰਘ			Guru gobind Singh is the bestower of godly blessings,				
21	ਮੁਨਇਮੁ ਲ-ਮੁਤਆਲ ਗੁਰੂ ਗੋਬਿੰਦ ਸਿੰਘ॥੧੨੬॥			And, he is the grantor of wealth and divine boons. (126)				
21	ਕਾਰਮੁੱਲ-ਕੱਰਾਮ ਗੁਰੂ ਗੋਬਿੰਦ ਸਿੰਘ			Guru Gobind Singh is even more benevolent for the generous,				
21	ਰਾਹਮੁੱਲ-ਰੱਹਾਮ ਗੁਰੂ ਗੋਬਿੰਦ ਸਿੰਘ॥੧੨੭॥			Guru Gobind Singh is even kindlier for the compassionate. (127)				
21	ਨਾਇਮੁਲ-ਮੁਨਆਮ ਗੁਰੂ ਗੋਬਿੰਦ ਸਿੰਘ			Guru Gobind Singh even bestows divine boons to those who themselves are blessed to do so;				
21	ਫ਼ਾਹਮੁਲ-ਫ਼ੱਹਾਮ ਗੁਰੂ ਗੋਬਿੰਦ ਸਿੰਘ॥੧੨੮॥			Guru Gobind Singh is the preceptor for the perceivers. Also the observer for the observent. (128)				
21	ਦਾਇਮੋ-ਪਾਇੰਦਾ ਗੁਰੂ ਗੋਬਿੰਦ ਸਿੰਘ			Guru Gobind Singh is stable and going to live forever,				
21	ਫ਼ੱਰਖ਼ੋ ਫ਼ਰਖ਼ੰਦਾ ਗੁਰੂ ਗੋਬਿੰਦ ਸਿੰਘ॥੧੨੯॥			Guru Gobind Singh is noble and extremely fortunate. (129)				
21	ਫ਼ੈਜ਼ਿ ਸੁਬਹਾਨ ਜ਼ਾਤਿ ਗੁਰੂ ਗੋਬਿੰਦ ਸਿੰਘ			Guru Gobind Singh is the blessing of the Omnipotent Waaheguru,				
21	ਨੂਰਿ ਹੱਕ ਲਮਆਤ ਗੁਰੂ ਗੋਬਿੰਦ ਸਿੰਘ॥੧੩੦॥			Guru Gobind Singh is the radiance-filled light of the divine ray. (130)				
21	ਸਾਮਆਨਿ ਨਾਮਿ ਗੁਰੂ ਗੋਬਿੰਦ ਸਿੰਘ			Listeners of the name of Guru Gobind Singh,				
21	ਹੱਕ-ਬੀਂ ਜ਼ਿ ਇਨਆਮਿ ਗੁਰੂ ਗੋਬਿੰਦ ਸਿੰਘ॥੧੩੧॥			With his blessings, are able to perceive Akaalpurakh. (131)				
21	ਵਾਸਫ਼ਾਨਿ ਜ਼ਾਤਿ ਗੁਰੂ ਗੋਬਿੰਦ ਸਿੰਘ			Admirers of the persona of Guru Gobind Singh				
21	ਵਾਸਿਲ ਅਜ਼ ਬਰਕਾਤਿ ਗੁਰੂ ਗੋਬਿੰਦ ਸਿੰਘ॥੧੩੨॥			Become legitimate recipients of his bountiful blessings. (132)				
21	ਰਾਕਿਮਾਨਿ ਵਸਫ਼ਿ ਗੁਰੂ ਗੋਬਿੰਦ ਸਿੰਘ			The scribe of the virtues of Guru Gobind Singh,				
21	ਨਾਮਵਰ ਅਜ਼ ਲੁਤਫ਼ਿ ਗੁਰੂ ਗੋਬਿੰਦ ਸਿੰਘ॥੧੩੩॥			Attain eminence and prominence with his kindness and blessings. (133)				
21	ਨਾਜ਼ਿਰਾਨਿ ਰੂਇ ਗੁਰੂ ਗੋਬਿੰਦ ਸਿੰਘ			Those who are fortunate enough to get a glimpse of the face of Guru Gobind Singh				
21	ਮਸਤਿ ਹੱਕ ਦਰ ਕੂਇ ਗੁਰੂ ਗੋਬਿੰਦ ਸਿੰਘ॥੧੩੪॥			Do get enamored and intoxicated in his love and affection while in his street. (134)				
21	ਖ਼ਾਕ-ਬੋਸਿ ਪਾਇ ਗੁਰੂ ਗੋਬਿੰਦ ਸਿੰਘ			Those who kiss the dust of the lotus feet of Guru Gobind Singh,				
21	ਮੁਕਬਲ ਅਜ਼ ਆਲਾਇ ਗੁਰੂ ਗੋਬਿੰਦ ਸਿੰਘ॥੧੩੫॥			Become accepted (in divine court) due to his blessings and boons. (135)				
21	ਕਾਦਿਰਿ ਹਰ ਕਾਰ ਗੁਰੂ ਗੋਬਿੰਦ ਸਿੰਘ			Guru Gobind Singh is capable to tackle any problem and issue,				
21	ਬੇਕਸਾਂ-ਰਾ ਯਾਰ ਗੁਰੂ ਗੋਬਿੰਦ ਸਿੰਘ॥੧੩੬॥			And, Guru Gobind Singh is the supporter of those who do not have any support. (136)				
21	ਸਾਜਿਦੋ ਮਸਜੂਦ ਗੁਰੂ ਗੋਬਿੰਦ ਸਿੰਘ			Guru Gobind Singh is both the worshiper and the worshiped,				
21	ਜੁਮਲਾ ਫ਼ੈਜ਼ੋ ਜੂਦ ਗੁਰੂ ਗੋਬਿੰਦ ਸਿੰਘ॥੧੩੭॥			Guru Gobind Singh is the composite of grace and largess. (137)				
