20	ਕਿ ਗ਼ੈਰ ਅਜ਼ ਜ਼ਿਕਰਿ ਤੂੰ ਨਬੂਦ ਦਰੂਨਿ ਬੰਦ ਬੰਦਿ ਮਨ॥੬੦॥੪॥			Because, there is not even a mention of anyone except you in each and every limb of my body and every drop of my blood. (60) (4)				
20	ਮਨਮ ਯੱਕ ਮੁਸ਼ਤਿ ਗਿਲ ਗੋਯਾ ਦਰੂਨਮ ਨੂਰਿ ਓ ਲਾਮਅ			Gayaa says, I am a just a fistful of dust, but my inner self is bright and satiated with the glow of eternal light of his rays,				
20	ਬਗ਼ਰਦਿਸ਼ ਦਾਇਮਾ ਗਰਦਦ ਦਿਲਿ ਪੁਰ ਹੋਸ਼ਮੰਦਿ ਮਨ॥੬੦॥੫॥			Therefore, my alert and sane mind always echoes that message. (60) (5)				
20	ਬੇਵਫ਼ਾ ਨੀਸਤ ਕਸੇ ਗਰ ਤੂ ਵਫ਼ਾਦਾਰ ਸ਼ਵੀ			Goyaa says, If you become faithful, then no one would betray you,				
20	ਵਕਤ ਆਨਸਤ ਕਿ ਬਰ ਵਕਤ ਖ਼ਬਰਦਾਰ ਸ਼ਵੀ॥੬੧॥੧॥			The time has come that you should be alert of this truth on time. (61) (1)				
20	ਜਾਂ ਅਗਰ ਹਸਤ ਸਿਰਿ ਕਦਮਿ ਜਾਨਾਂ ਕੁਨ			If you are alive, then offer your heart as a sacrifice for His lotus feet,				
20	ਦਿਲ ਬ-ਦਿਲਦਾਰ ਬਿਦਿਹ ਜ਼ਾਕਿ ਤੂ ਦਿਲਦਾਰ ਸ਼ਵੀ॥੬੧॥੨॥			Present your heart and mind to your Beloved, so that you, yourself, would become a beloved. (61) (2)				
20	ਮੰਜ਼ਿਲਿ ਇਸ਼ਕ ਦਰਾਜ਼ ਅਸਤ ਬ-ਪਾ ਨਤਵਾਂ ਰਫ਼ਤ			The journey of love and devotion is extremely long and arduous; it cannot be traversed by walking on foot,				
20	ਸਰ ਕਦਮ ਸਾਜ਼ ਕਿ ਤਾ ਦਰ ਰਹਿ ਆਂ ਯਾਰ ਸ਼ਵੀ॥੬੧॥੩॥			We should walk making our head as our feet, so that we can travel on the path towards our Beloved and the trek can be completed. (61) (3)				
20	ਗੁਫ਼ਤਗੂਇ ਹਮਾ ਕਸ ਦਰ ਖ਼ੋਰਿ ਇਦਰਾਕਿ ਖ਼ੁਦ ਅਸਤ			The conversation of each one of us is based upon our perception and knowledge,				
20	ਲਭ ਫ਼ਰੋਬੰਦ ਕਿ ਤਾ ਮਹਿਰਮਿ ਅਸਰਾਰ ਸ਼ਵੀ॥੬੧॥੪॥			But you should keep your lips sealed so that you can realize and appreciate the truth about His mysteries. (61) (4)				
20	ਮੀ ਫ਼ਰੋਸ਼ਦ ਦਿਲਿ ਦੀਵਾਨਾਇ ਖ਼ੁਦ ਰਾ ਗੋਯਾ			Goyaa says, I am presenting my infatuated mind for sale on the hope that				
20	ਬ-ਉਮੀਦਿ ਕਰਮਿ ਆਂ ਕਿ ਖ਼ਰੀਦਾਰ ਸ਼ਵੀ॥੬੧॥੫॥			You, the Guru, with your benevolence, might become its purchaser. (61) (5)				
20	ਸਾਕੀ ਮਰਾ ਤੋ ਜੁੱਰਾ-ਇ ਜਾਂ ਇਸਤਿਆਕ ਦੇਹ			O bartender! Kindly put my beloved in the cup of life; the urge to survive,				
20	ਤਾ ਰੂਏ ਤੇ ਬੀਨਮ, ਦੂਰੀ ਫ਼ਰਾਕ ਦੇਹ॥੬੨॥੧॥			So that I may live to see my beloved's face when I am free from separation. (62) (1)				
20	ਦਰ ਹਰ ਤਰਫ਼ ਬੀਨਮ, ਚੂੰ ਰੁਖ਼ਿ ਤੁਰਾ ਮੁਦਾਮ			I look for your glimpse in every direction, but in vain				
20	ਬਾ ਦਿਲ ਮਰਾ ਖ਼ਲਾਸੀ, ਅਜ਼ ਅਫ਼ਤਰਾਕ ਦੇਹ॥੬੨॥੨॥			O heart! Kindly release me from life so that I can surrender before separation sets in. (62) (2)				
20	ਚੂੰ ਬੇ ਤੋ ਹੇਚ ਨੇਸਤ ਚੂੰ ਬੀਨੇਮ ਬ-ਹਰ ਕੁਜਾਸਤ			Everything is futile and every place is void without you, this is so everywhere,				
20	ਤਾ ਦੀਦਹ ਓ ਦਿਲਿ ਮਰਾ, ਤੋ ਇੰਤਫ਼ਾਕ ਦੇਹ॥੬੨॥੩॥			Grant me the unity for my worldly heart and eyes that I can see you. (62) (3)				
20	ਚੂੰ ਸਾਫ਼ ਗਸ਼ਤ ਆਈਨਾ-ਇ ਦਿਲ ਅਜ਼ ਸਵਾਦਿ ਗ਼ਮ			Scrape off the dross of sorrow from the mirror of my heart,				
20	ਬਾ ਵਸਲ ਖ਼ੁਦ-ਨਮਾਈ, ਰਿਹਾਈ ਜ਼ਿ ਬਾਂਕ ਦੇਹ॥੬੨॥੪॥			So that I see only your reflection in it and with it, the terror of separation is ended (62) (4)				
20	ਗੋਇਆ ਬ-ਹਰ ਕੁਜਾ ਕਿ ਬ-ਬੀਨਮ ਜਮਾਲਿ ਤੋ			Goyaa says, I should be able to see only you and your splendid colors,				
20	ਤਾ ਦਿਲਿ ਮਰਾ ਖ਼ਲਾਸੀਏ, ਅਜ਼ ਦਰਦਨਾਕ ਦੇਹ॥੬੨॥੫॥			I seek release from tis bondage and the pain of separation. (62 ) (5)				
20	ਬੇਵਫ਼ਾ ਨੇਸਤ ਕਸੇ, ਗਰ ਤੂ ਵਫ਼ਾਦਾਰ ਸ਼ਵੀ			If you believe in yourself, then no one shall be a non-believer or faithless,				
20	ਵਕਤ ਆਂਸੂ ਕਿ: ਬਰ ਵਕਤ, ਖ਼ਬਰਦਾਰ ਸ਼ਵੀ॥੬੩॥੧॥			Times are such that they will demand alertness every moment. (63) (1)				
20	ਜ਼ਾਂ ਅਗਰ ਹਸਤ, ਨਸਾਰਿ ਕਦਮਿ ਜਾਨਾਂ ਕੁਨ			If you have life in you, you should sacrifice it at the feet of the beloved,				
20	ਦਿਲ ਬ-ਦਿਲਦਾਰ ਬਦਿਹ, ਜ਼ਾਂ ਕਿ: ਦਿਲਦਾਰ ਸ਼ਵੀ॥੬੩॥੨॥			O heart! You should offer yourself uninhibitingly to your beloved so that you would also be loved. (63) (2)				
20	ਮੰਜ਼ਲਿ ਇਸ਼ਕ ਦਰਾਜ਼ ਅਸਤ ਬਾ-ਪਾ ਨ-ਤਤਵਾਂ ਰਫ਼ਤ			Destination of love is too far and long; it cannot be reached using the feet,				
20	ਸਰ ਕਦਮ ਸਾਜ਼, ਕਿ: ਤਾ ਦਰ ਰਾਹਿ ਆਂ ਯਾਰ ਸ਼ਵੀ॥੬੩॥੩॥			Sacrifice your head, make it your feet before you embark on the road to your beloved. (63) (3)				
20	ਗੁਫ਼ਤਗੂਏ ਹਮਾ ਕਸ ਦਰ ਇਦਰਾਕਿ ਖ਼ੁਦ ਅਸਤ			Everyone indulges into conversation according to his wits,				
20	ਲਬ ਫ਼ਿਰੋਬੰਦ ਕਿ: ਤਾ ਮਹਰਮਿ ਇਸਰਾਰ ਸ਼ਵੀ॥੬੩॥੪॥			However, you should keep your lips tightly closed if you are anxious to share the secrets of the beloved. (63) (4)				
20	ਮੇ ਫ਼ਰੋਸ਼ਦ ਦਿਲਿ ਦੀਵਾਨਾ-ਇ ਖ਼ੁਦ ਰਾ, ਗੋਇਆ			Goyaa says, I want to sell myself and my insane heart to my beloved,				
20	ਬਾ ਉਮੀਦਿ ਕਰਮਿ ਆਂ, ਕਿ: ਖ਼ਰੀਦਾਰ ਸ਼ਵੀ॥੬੩॥੫॥			With my faith in his grace and mercy, I am sure he will find it worthy of buying. (63) (5)				
1	ਰੁਬਾਈਆਂ			4-Line Verses				
1	ਹਰ ਕਸ ਜ਼ਿ ਸ਼ੌਕਿ ਤੂ ਕਦਮ ਅਜ਼ ਸਰ ਸਾਖ਼ਤ			Everyone, with his zeal for you, started to walk on his head,				
1	ਬਰ ਨਹੁ ਤਬਕ ਚਰਖ਼ਿ ਅਲਮ ਸਰ ਅਫ਼ਰਾਖ਼ਤ			And, he was able to pitch his flag over the nine skies,				
1	ਸ਼ੁਦ ਆਮਦਨਸ਼ ਮੁਬਾਰਿਕ ਰਫ਼ਤਨ ਹਮ			Blessed is his coming to this world, and equally blessed is his departure,				
1	ਗੋਯਾ ਆਂ ਕਸ ਕਿ ਰਾਹਿ ਹੱਕ ਰਾ ਬਿਸ਼ਨਾਖ਼ਤ॥੧॥			Goyaa says, The one who has perceived the Lord. (1)				
1	ਕੂਰ ਅਸਤ ਹਰ ਆਂ ਦੀਦਾ ਕਿ ਹੱਕ ਰਾ ਨਭਸ਼ਨਾਖ਼ਤ			Every such eye that did not recognize (the existence) of Akaalpurakh, can be considered as blind,				
1	ਈਂ ਉਮਰਿ ਗਿਰਾਂ ਮਾਯਾ ਬ-ਗ਼ਫ਼ਲਤ ਦਰਬਾਖ਼ਤ			He wasted this precious life in negligence and carelessness,				
1	ਊ ਗਿਰੀਆਂ ਕੁਨਾਂ ਆਮਦ ਬ-ਹਸਰਤ ਮੁਰਦ			He came (to this world) crying and passed away taking all his yearnings and unfulfilled hopes with him,				
1	ਅਫ਼ਸੋਸ ਦਰੀਂ ਆਮਦ ਸ਼ੁਦ ਕਾਰੇ ਨਭਸਾਖ਼ਤ॥੨॥			Alas! He was unable to better his disposition in this cycle of birth and death. (2)				
1	ਈਂ ਚਸ਼ਮਿ ਤੂ ਖ਼ਾਨਾ ਦਾਰਿ ਜਾਨਾਨਸਤ			This eye of yours is the abode of the Beloved virtuous friend,				
1	ਈਂ ਤਖ਼ਤਿ ਵਜੂਦਿ ਮਸਨਦਿ ਸੁਲਤਾਨਸਤ			Your personality is the seat of His royal throne,				
1	ਹਰ ਬੂਅਲਹਵਸੇ ਬਸੂਇ ਊ ਰਾਹ ਨ ਬੁਰਦ			Anyone immersed in greed and lust cannot reach the powerful Almighty,				
1	ਕਿ ਈਂ ਰਾਹ ਤਅੱਲਕਿ ਮੰਜ਼ਲਿ ਮਰਦਾਨਸਤ॥੩॥			Because this path is meant for the brave and the valiant devotees of Waaheguru. (3)				
1	ਹਰ ਦਿਲ ਕਿ ਬਰਾਹਿ ਰਾਸਤ ਜਾਨਾਂ ਸ਼ੁਦਾ ਅਸਤ			Every such heart and mind that spontaneously (by acquiring the virtues of) became the divine Beloved,				
1	ਤਹਿਕੀਕ ਬਿਦਾਂ ਕਿ ਐਨਿ ਜਾਨਾਂ ਸ਼ੁਦਾ ਅਸਤ			Rest assured! That he became the embodiment of Akaalpurakh Himself,				
1	ਯੱਕ ਜ਼ੱਰਾ ਜ਼ਿ ਫ਼ੈਜ਼ਿ ਰਹਿਮਤਸ਼ ਖ਼ਾਲੀ ਨੀਸਤ			Not even a particle of dust is then without his benevolence and blessing,				
1	ਨੱਕਾਸ ਦਰੂਨਿ ਨਕਸ਼ ਪਿਨਹਾਂ ਸ਼ੁਦਾ ਅਸਤ॥੪॥			And, the Sculptor-Painter is camouflaging Himself behind His colors. (4)				
1	ਈਂ ਆਮਦੋ ਰਫ਼ਤ ਜੁਜ਼ ਦਮੇ ਬੇਸ਼ ਨਬੂਦ			This coming and departing in this world is no more than a moment,				
1	ਹਰ ਜਾ ਕਿ ਨਜ਼ਰ ਕੁਨੇਮ ਜੁਜ਼ ਖ਼ੇਸ਼ ਨਬੂਦ			Wherever we run our vision and see around, we see only our own images,				
1	ਮਾਂ ਜਾਨਿਬਿ ਗ਼ੈਰ ਚੂੰ ਂਨਿਗਾਹ ਬਿਕੁਨੇਮ			How can we ever dare to look towards anyone else?				
1	ਚੂੰ ਗ਼ੈਰ ਤੂ ਹੀਚ ਕਸੇ ਪਸੋ ਪੇਸ਼ ਨਬੂਦ॥੫॥			Because, there is no one else (except Waaheguru) in the front or rear who is supporting us. (5)				
1	ਹਰ ਬੰਦਾ ਕੂ ਤਾਲਿਬਿ ਮੌਲਾ ਬਾਸ਼ਦ			Every such person who is a seeker of the Divinity,				
1	ਦਰ ਹਰ ਦੋ ਜਹਾਂ ਰੁਤਬਾ-ਅੰਸ਼ ਊਲਾ ਬਾਸ਼ਦ			Has a highest rank and status in both the worlds;				
1	ਗੋਯਾ ਦੋ ਜਹਾਂ ਰਾ ਬ-ਜੌਏ ਬਿ-ਸਤਾਨੰਦ			Goyaa says, They can acquire both the worlds in exchange for just a grain of barley,				
1	ਮਜਨੂੰਨਿ ਤੂ ਕੈ ਆਸ਼ਕਿ ਲੈਲਾ ਬਾਸ਼ਦ॥੬॥			When and how would I, Your beloved (like Majnoo was) become Your lover (like Lailaa)? (6)				
1	ਦਰ ਦਹਿਰ ਕਿ ਮਰਦਾਨਿ ਖ਼ੁਦਾ ਆਮਦਾ ਅੰਦ			When men of God manifest themselves in this world,				
1	ਬਰ ਗ਼ੁਮ-ਸ਼ੁਦਗਾਨਿ ਰਹਿਨੁਮਾ ਆਮਦਾ ਅੰਦ			They come as leaders to put the strayed people on to the right path;				
1	ਗੋਯਾ ਅਗਰ ਈਂ ਚਸ਼ਮਿ ਤੂ ਮੁਸ਼ਤਾਕਿ ਖ਼ੁਦਾ ਅਸਤ			Goyaa says, If your eye is desirous of the Almighty,				
1	ਮਰਦਾਨਿ ਖ਼ੁਦਾ ਖ਼ੁਦਾ-ਨੁਮਾ ਆਮਦਾ ਅੰਦ॥੭॥			Then realize that the noble souls of God come to this earth only to reveal Him. (7)				
1	ਦਰ ਮਜ਼ਹਬਿ ਮਾ ਗ਼ੈਰ-ਪਰਸਤੀ ਨ ਕੁਨੰਦ			People of our faith do not worship anyone else (other than Akaalpurakh),				
1	ਸਰ ਤਾ ਬਕਦਮ ਬਹੋਸ਼ ਓ ਮਸਤੀ ਨ ਕੁਨੰਦ			They are always mindful and alert and never act or behave wantonly,				
1	ਗ਼ਾਫ਼ਲਿ ਨਸ਼ਵੰਦ ਯਕ ਦਮ ਅਜ਼ ਯਾਦਿ ਖ਼ੁਦਾ			They are not negligent of the remembrance of Waaheguru even for one moment/breath,				
1	ਦੀਗਰ ਸੁਖ਼ਨ ਅਜ਼ ਬੁਲੰਦੋ ਪਸਤੀ ਨ ਕੁਨੰਦ॥੮॥			Additionally, they do not get involved in topics relating to higher or lower classes of the society. (8)				
1	ਯੱਕ ਜ਼ੱਰਾ ਅਗਰ ਸ਼ੌਕਿ ਇਲਾਹੀ ਬਾਸ਼ਦ			If one has even the slightest inkling of fondness for the Lord,				
1	ਬਿਹਤਰ ਕਿ ਹਜ਼ਾਰ ਬਾਦਸ਼ਾਹੀ ਬਾਸ਼ਦ			Then, that is far superior to thousands of kingdoms,				
1	ਗੋਯਾ-ਸਤ ਗ਼ੁਲਾਮਿ ਮੁਰਸ਼ਦਿ ਖ਼ੇਸ਼			Goyaa says, I am the slave of my true Guru,				
1	ਈਂ ਖ਼ਤ ਨ ਮੁਹਤਾਜਿ ਗਵਾਹੀ ਬਾਸ਼ਦ॥੯॥			And this written assertion does not need any witnesses. (9)				
1	ਹਰ ਕਸ ਬ-ਜਹਾ ਨਸ਼ਵੋ ਨੁਮਾ ਮੀ ਖ਼ਾਹਦ			Every human being in this world likes to progressively prosper and professionally advance,				
1	ਅਸਪੋ ਸ਼ੁਤਰੋ ਫ਼ੀਲੋ ਤਿਲਾ ਮੀ ਖ਼ਾਹਦ			He/She has strong desire to acquire horses, camels, elephants and gold;				
1	ਹਰ ਕਸ ਜ਼ਿ ਬਰਾਇ ਖ਼ੇਸ਼ ਚੀਜ਼ੇ ਮੀ ਖ਼ਾਹਦ			Every one always longs to have something or the other for himself;				
1	ਗੋਯਾ ਜ਼ਿ ਖ਼ੁਦਾ ਯਾਦਿ ਖ਼ੁਦਾ ਮੀ ਖ਼ਾਹਦ॥੧੦॥			However, Goyaa says, I always supplicate to the Lord to bless me only with His remembrance. (10)				
2	ਪੁਰ ਗਸ਼ਤਾ ਜ਼ਿ ਸਰ ਤਾ ਬ-ਕਦਮ ਨੂਰ-ਉਲ-ਨੂਰ			Goyaa says that His Guru is satiated with radiance and splendor from head to feet;				
2	ਆਈਨਾ ਕਿ ਦਰ ਵੈਨ ਬਵਦ ਹੀਚ ਕਸੂਰ			He is a mirror that has no cracks;				
2	ਤਹਿਕੀਕ ਬਿਦਾਂ ਜ਼ਿ ਗ਼ਾਫ਼ਿਲਾਂ ਦੂਰ ਬਵਦ			Rest assured: That he shuns away from the careless and the negligent;				
2	ਊ ਦਰ ਦਿਲਿ ਆਰਿਫ਼ ਕਰਦਾ ਜ਼ਹੂਰ॥੧੧॥			And he manifests only in the hearts of holy and pious persons. (11)				
2	ਈਂ ਉਮਰਿ ਗਿਰਾਂ-ਮਾਯਾ ਕਿ ਬਰਬਾਦ ਸ਼ਵਦ			This priceless life that is wasted for nothing,				
2	ਈਂ ਖ਼ਾਨਾਇ ਵੀਰਾਂ ਬ-ਚਿਹ ਆਬਾਦ ਸ਼ਵਦ			And how can this desolate home be rehabilitated and settled?				
2	ਤਾ ਮੁਰਸ਼ਦਿ ਕਾਮਿਲ ਨਦਿਹਦ ਦਸਤ ਬ੍ਰਹਮ			Goyaa says, (This can happen) Only when a complete Guru stands by your side and helps; And this may be the only way that				
2	ਗੋਯਾ ਦਿਲਿ ਗ਼ਮਗੀਨ ਤੂ ਚੂੰ ਸ਼ਾਦ ਬਵਦ॥੧੨॥			My heart filled with worries and griefs can be elevated to elation? (12)				
2	ਦਿਲਿ ਜ਼ਾਲਮਿ ਬ-ਕਸਦਿ ਕੁਸ਼ਤਨਿ ਮਾ-ਸਤ			The fiendish has the intention to destroy us,				
2	ਦਿਲਿ ਮਜ਼ਲੂਮਿ ਮਨ ਬਸੂਇ ਖ਼ੁਦਾ ਸਤ			On the other hand, my vulnerable mind is expecting help and relief from the Almighty;				
2	ਊ ਦਰੀਂ ਫ਼ਿਕਰ ਤਾਂ ਬਮਾ ਚਿਹ ਕੁਨਦ			The brute is concerned as to what should He do with him?				
2	ਮਾ ਦਰੀਂ ਫ਼ਿਕਰ ਤਾ ਖ਼ੁਦਾ ਚਿਹ ਕੁਨਦ॥੧੩॥			And, we are concerned as to how does the Almighty respond to our plea? (13)				
2	ਦਰ ਹਾਸਿਲਿ ਉਮਰ ਆਂ ਚਿਹ ਮਾ ਯਾਫ਼ਤਾ ਏਮ			What did we gain from this priceless life?				
2	ਦਰ ਹਰ ਦੋ-ਜਹਾਂ ਯਾਦਿ ਖ਼ੁਦਾ ਯਾਫ਼ਤਾ ਏਮ			We were able to achieve the remembrance of the Omnipotent in both the worlds;				
2	ਈਂ ਹਸਤੀਏ ਖ਼ੇਸ਼ਤਨ ਬਲਾ ਬੂਦ ਅਜ਼ੀਮ			This personality of ours was a huge monster,				
2	ਅਜ਼ ਖ਼ੇਸ਼ ਗੁਜ਼ਸ਼ਤੇਮ ਖ਼ੁਦਾ ਯਾਫ਼ਤਾ ਏਮ॥੧੪॥			When we gave up our ego and vanity, we attained the Ultimate, the Lord. (14)				
2	ਅਜ਼ ਖ਼ਾਕਿ ਦਰਿ ਤੂ ਤੂਤੀਆ ਯਾਫ਼ਤਾਏਮ			We obtained collyrium from the dust of Your door;				
2	ਕਜ਼ ਦੌਲਤਿ ਆਂ ਨਸ਼ਵੋ ਨੁਮਾ ਯਾਫ਼ਤਾਏਮ			Because of which we gained the prosperity and progress;				
2	ਮਾ ਸਿਜਦਾ ਬਰ ਰੂਇ ਗ਼ੈਰ ਦੀਗਰ ਨਭਕੁਨੇਮ			We have never bowed before anyone other than You,				
2	ਦਰ ਖ਼ਾਨਾਇ ਦਿਲ ਨਕਸ਼ਿ ਖ਼ੁਦਾ ਯਾਫ਼ਤਾਏਮ॥੧੫॥			We have discovered the symptoms of the Omnipresent within the abode of our heart. (15)				
2	ਗੋਯਾ ਖ਼ਬਰ ਅਜ਼ ਯਾਦਿ ਖ਼ੁਦਾ ਯਾਫ਼ਤਾਏਮ			Goyaa says, I have been able to get the inkling about the kaalpurakh from His remembrance,				
2	ਈਂ ਜਾਮਿ ਲਬਾ-ਲਬ ਅਜ਼ ਕੁਜਾ ਯਾਫ਼ਤਾਏਮ			Otherwise, how could I have obtained this full-to-the-brim cup of devotion and affection?				
2	ਜੁਜ਼ ਤਾਲਿਬਿ ਹੱਕ ਨਸੀਬਿ ਹਰ ਕਸ ਨ ਬਵਦ			Except the seeker of Lord, no one else is destined to have				
2	ਈਂ ਦੌਲਤਿ ਨਾਯਾਬ ਕਿ ਮਾ ਯਾਫ਼ਤਾਏਮ॥੧੬॥			This valuable treasure that I have had the good fortunate to obtain. (16)				
2	ਗੋਯਾ ਤਾ ਕੈ ਦਰੀਂ ਸਰਾਏ ਮਾਦੂਅਮ			Goyaa says, How long are you going to stay in this perishable world,				
2	ਗਾਹੇ ਲਾਜ਼ਮ ਸ਼ਵਦ ਵ ਗਾਹੇ ਮਲਜ਼ੂਮ			That sometimes becomes so essential and other times so assigned?				
2	ਤਾ ਕੈ ਚੂ ਸਗਾਂ ਬਰ ਉਸਤਖ਼ਾਂ ਜੰਗ ਕੁਨੇਮ			How long are we going to fight over bones like dogs ?				
2	ਦੁਨਿਆ ਮਾਲੂਅਮ ਅਹਿਲਿ ਦੁਨਿਆ ਮਾਲੂਅਮ॥੧੭॥			We all know about this world and these worldly people, (how selfish and merciless they are). (17)				
2	ਗੋਯਾ ਅਗਰ ਆਂ ਜਮਾਲ ਦੀਦਨ ਦਾਰੀ			Goyaa says, If you desire to see the splendor and glory of Waaheguru?				
2	ਅਜ਼ ਖ਼ੁਦ ਹਵਸ ਮੈਲਿ ਰਮੀਦਨ ਦਾਰੀ			If you are trying to shun away from the sin of your greed and lust and have the stomach for meidtation?				
2	ਜ਼ੀਂ ਦੀਦਾ ਮਬੀਂ ਕਿ ਹਜ਼ਾਬ ਸਤ ਤੁਰਾ			Then you should not see with these overt and ostensible eyes, because they are the obstacle for you;				
2	ਬੇ-ਦੀਦਾ ਬਿਬੀਂ ਹਰ ਆਂ ਚਿਹ ਦੀਦਨ ਦਾਰੀ॥੧੮॥			In fact, you should try to introspect without your eyes whatever you want to see. (And you would be successful) (18)				
2	ਮੌਜੂਦ ਖ਼ੁਦਾਸਤ ਤੂ ਕਿਰਾ ਮੀ ਜੋਈ			Akaalpurakh is Omnipresent. Then whom are you searching for?				
2	ਮਕਸੂਦ ਖ਼ੁਦਾਸਤ ਤੂ ਕੁਜਾ ਮੀ ਪੋਈ			A meeting with the Benevolent is the aim of our life; where are you straying?				
2	ਈਂ ਹਰ ਦੋ ਜਹਾਂ ਨਿਸ਼ਾਨਿ ਦੌਲਤਿ ਤੁਸਤ			Both these worlds are the symbols of your mastery and control;				
2	ਯਾਅਨੀ ਸੁਖ਼ਨ ਅਜ਼ ਜ਼ਬਾਨਿ ਹੱਕ ਮੀ ਗੋਈ॥੧੯॥			That is, you are speaking the word of God through your own tongue. (19)				
2	ਮਬਰ ਐ ਬਾਦ ਖ਼ਾਕਮ ਅਜ਼ ਦਰਿ ਦੂਸਤ			O wind! Do not blow away my dust from the door of my Beloved,				
2	ਦੁਸ਼ਮਨਮ ਸਰਜ਼ਨਸ਼ ਕੁਨਦ ਕਿ ਹਰ ਜਾਈਸਤ॥੧॥			Otherwise, the adversary will slander (the claim) that He happens to be everywhere. (1)				
2	ਨੀਸਤ ਗ਼ੈਰ ਅਜ਼ ਆਂ ਸਨਮ ਦਰ ਪਰਦਾਇ ਦੈਰੋ ਹਰਮ			There is no one else other than the Waaheguru inside Kaabaa or the temple;				
2	ਕੈ ਬਵਦ ਆਤਿਸ਼ਿ ਦੋ ਰੰਗ ਅਜ਼ ਇਖ਼ਤਲਾਫ਼ਿ ਸੰਗ ਹਾ॥੨॥			How can the fire assume two different colors due to differences in the basic structure and make-up of stones? (2)				
2	ਆਸਮਾਂ ਸਿਜਦਾ ਕੁਨਦ ਪੇਸ਼ਿ ਜ਼ਮੀਂ ਕਿ ਬਰ ਊ			The sky is bowing before the earth,				
2	ਯੱਕ ਦੋ ਨਫ਼ਸ ਅਜ਼ ਪੈਏ ਜ਼ਿਕਰਿ ਖ਼ੁਦਾ ਬਿਨਸ਼ੀਨੰਦ॥੩॥			Because of the fact, devotees of Akaalpurakh squat here for a moment or two in His meditation. (3)				
2	ਬਜ਼ੇਰਿ ਸਾਇਆਇ ਤੂਬਾ ਮੁਰਾਦ ਹਾ ਯਾਬੀ			Under the shade of Kalap tree, one can have all his wishes fulfilled,				
2	ਬਜ਼ੇਰ ਸਾਇਆ ਮਰਦਾਨਿ ਹੱਕ ਖ਼ੁਦਾ ਯਾਬੀ॥੪॥			However, under the shade (protection) of men of God, the saintly persons, one can attain God Himself. (4)				
1	ਜ਼ਿੰਦਗੀ ਨਾਮਾ			ZINDAGEE NAAMAA				
1	ਆਂ ਖ਼ੁਦਾਵੰਦਿ ਜ਼ਮੀਨੋ ਆਸਮਾਂ			The Akaalpurakh is the Master of the earth and the skies,				
1	ਜ਼ਿੰਦਗੀ ਬਖ਼ਸ਼ਿ ਵਜੂਦਿ ਇਨਸੋ ਜਾਂ॥੧॥			He is the one who bestows life to human beings and other living beings. (1)				
1	ਖ਼ਾਕਿ ਰਾਹਸ਼ ਤੂਤੀਯਾਇ ਚਸ਼ਮਿ ਮਾਸਤ			The dust on the path of Waaheguru serves like a collyrium to our eyes.				
1	ਆਬਰੂ ਅਫ਼ਜ਼ਾਇ ਹਰ ਸ਼ਾਹੋ ਗਦਾ ਸਤ॥੨॥			In fact, He is the one who elevates the honor and esteem of every king and every saintly soul. (2)				
1	ਹਰ ਕਿਹ ਬਾਸ਼ਦ ਦਾਯਮਾ ਦਰ ਯਾਦਿ ਊ			Anyone who lives his life under a constant remembrance of Akaalpurakh,				
1	ਯਾਦਿ ਹੱਕ ਹਰ ਦਮ ਬਵਦ ਇਰਸ਼ਾਦਿ ਊ॥੩॥			Will always prompt and motivate others for the meditation of the Almighty. (3)				
1	ਗਰ ਤੂ ਦਰ ਯਾਦਿ ਖ਼ੁਦਾ ਬਾਸ਼ੀ ਮੁਦਾਮ			If you can constantly and always stay imbued in Akaalpurakh's meditation,				
1	ਮੀ ਸ਼ਵੀ ਐ ਜਾਨਿ ਮਨ ਮਰਦਿ ਤਮਾਮ॥੪॥			Then, O my heart and soul! You can become a complete and perfect person. (4)				
1	ਆਫਤਾਬਿ ਹਸਤ ਪਿਨਹਾਂ ਜ਼ੇਰਿ ਅਬਰ			He, the Akaalpurakh, like the sun, is hidden behind the clouds of the material world,				
1	ਬਿਗੁਜ਼ਰ ਅਜ਼ ਅਬਰੋ ਨੁਮਾ ਰੁਖਿ ਹਮਚੂ ਬਦਰ॥੫॥			Goyaa says, Kindly come out of the clouds and show me Your full-moon-like face. (5)				
1	ਈਂ ਤਨਤ ਅਬਰੇਸਤ ਦਰ ਵੈ ਆਫਤਾਬ			This body of yours is like a cloud under which is hidden the Sun (God),				
1	ਯਾਦਿ ਹੱਕ ਮੀਦਾਂ ਹਮੀਂ ਬਾਸ਼ਦ ਸਵਾਬ॥੬॥			Remember to engage yourself in the divine devotion because this is the only purpose (fruit) of this life. (6)				
1	ਹਰਕਿ ਵਾਕਿਫ਼ ਸ਼ੁਦ ਅਜ਼ ਅਸਰਾਰਿ ਖ਼ੁਦਾ			Whosoever has become cognizant of the mysteries of Waaheguru,				
1	ਹਰ ਨਫ਼ਸ ਜੁਜ਼ ਹੱਕ ਨ ਦਾਰਦ ਮੁਦਆ॥੭॥			He has no other purpose except to remember Him every moment of his life. (7)				
1	ਕਹ ਚਿਹ ਬਾਸ਼ਦ ਯਾਦਿ ਆਂ ਯਜ਼ਦਾਨਿ ਪਾਕ			What is the truth? It is the memory of the Almighty that is the stark truth;				
1	ਕੈ ਬਿਦਾਨਦ ਕਦਰਿ ਊ ਹਰ ਮੁਸ਼ਤਿ ਖ਼ਾਕ॥੮॥			In fact, how can a fistful of dirt or dust, the human body, appreciate His real value? (8)				
1	ਸੁਹਬਤਿ ਨੇਕਾਂ ਅਗਰ ਬਾਸ਼ਦ ਨਸੀਬ			If you have the good fortune to have the company and association of the noble persons,				
1	ਦੌਲਤਿ ਜਾਵੀਦ ਯਾਬੀ ਐ ਹਬੀਬ॥੯॥			Then my friend! You would have attained eternal wealth. (9)				
1	ਦੌਲਤ ਅੰਦਰ ਖ਼ਿਦਮਤਿ ਮਰਦਾਨਿ ਉਸਤ			This (God given) wealth is meant to be used in the service of His creations, the people;				
1	ਹਰਿ ਗਦਾ ਓ ਪਾਦਸ਼ਾਹ ਕੁਰਬਾਨਿ ਉਸਤ॥੧੦॥			Every beggar and emperor is willing to sacrifice himself for it, the true wealth. (10)				
1	ਖ਼ੂਇ ਸ਼ਾਂ ਗੀਰ ਐ ਬ੍ਰਾਦਰ ਖ਼ੂਇ ਸ਼ਾਂ			O brother! You should acquire the traits of those who constantly remember the Beneficent;				
1	ਦਾਯਮਾ ਮੀ ਗਰਦ ਗਿਰਦਿ ਕੂਇ ਸ਼ਾਂ॥੧੧॥			And, you should circle around the (street) locality they reside in again and again (so that you may get an opportunity to be blessed with their company.) (11)				
1	ਹਰ ਕਿਹ ਗਿਰਦਿ ਕੂਇ ਸ਼ਾਂ ਗਰਦੀਦ ਯਾਫ਼ਤ			If anyone keeps going around the streets of these noble souls,				
1	ਦਰ ਦੋ ਆਲਮ ਹਮ ਚੂ ਮਿਹਰੋ ਬਦਰ ਤਾਫ਼ਤ॥੧੨॥			He would have attained the light and radiance of the sun and the moon in both the worlds. (12)				
1	ਦੌਲਤਿ ਜਾਵੀਦ ਬਾਸ਼ਦ ਬੰਦਗੀ			(We must realize) that meditation is an eternal treasure;				
1	ਬੰਦਗੀ ਕੁਨ ਬੰਦਗੀ ਕੁਨ ਬੰਦਗੀ॥੧੩॥			Therefore, we should engage ourselves in meditation, worship and prayers before the Almighty. (13)				
1	ਦਰ ਲਿਬਾਸਿ ਬੰਦਗੀ ਸ਼ਾਹੀ ਤੁਰਾਹਸਤ			The entire kingdom (of the world) is encompassed in the remembrance of (the Naam of) Waaheguru;				
1	ਦੌਲਤੇ ਅਜ਼ ਮਾਹ ਤਾ ਮਾਹੀ ਤੁਰਾਹਸਤ॥੧੪॥			And, it is only His realm extending from the moon to the sun. (14)				
1	ਹਰ ਕਿਹ ਗ਼ਾਫ਼ਿਲ ਸ਼ੁਦ ਅਜ਼ੂ ਨਾਦਾਂ ਬਵਦ			Anyone who is oblivious and unmindful of (the existence of) Akaalpurakh, consider him as an idiot;				
1	ਗਰ ਗਦਾ ਬਾਸ਼ਦ ਵਗਰ ਸੁਲਤਾਂ ਬਵਦ॥੧੫॥			No matter whether he is a beggar or the emperor king. (15)				
1	ਸ਼ੌਕਿ ਮੌਲਾ ਅਜ਼ ਹਮਾ ਬਾਲਾ ਤਰ ਅਸਤ			The love of God is the loftiest of all the traits for us,				
1	ਸਾਯਾਇ ਊ ਬਰ ਸਰਿ ਮਾ ਅਫ਼ਸਰ ਅਸਤ॥੧੬॥			And His shadow (on our heads) is like a tiara on our heads. (16)				
1	ਸ਼ੌਕਿ ਮੌਲਾ ਮਾਅਨੀਏ ਜ਼ਿਕਰਿ ਖ਼ੁਦਾ-ਸਤ			Devotion for Akaalpurakh is considered as Aremembrance of Him,				
1	ਕਾਂ ਤਲਿਸਮਿ ਚਸ਼ਮ ਮਾ ਰਾ ਕੀਮੀਆ ਸਤ॥੧੭॥			Because, his enchanting glance (towards us) is like a healing medicine for all of us. (17)				
1	ਸ਼ੌਕਿ ਮੌਲਾ ਜ਼ਿੰਦਗੀਇ ਜਾਨਿ ਮਾ-ਸਤ			The love of Waaheguru is the life of our heart and soul,				
